{
  "dfd_id": "DFD-run-2026-09-23-001-merged",
  "run_id": "run-2026-09-23-001",
  "viewpoint": "merged",
  "elements": [
    {
      "element_id": "ext-tenant-user",
      "type": "external_entity",
      "kind": null,
      "name": "租戶使用者（瀏覽器）",
      "from": null,
      "to": null,
      "crosses": [],
      "provenance": "g1_declared",
      "evidence_refs": []
    },
    {
      "element_id": "proc-invoices-api",
      "type": "process",
      "kind": null,
      "name": "發票 API",
      "from": null,
      "to": null,
      "crosses": [],
      "provenance": "deterministic",
      "evidence_refs": [
        "endpoint:GET /api/invoices/{id}"
      ]
    },
    {
      "element_id": "proc-support-agent",
      "type": "process",
      "kind": null,
      "name": "客服 agent",
      "from": null,
      "to": null,
      "crosses": [],
      "provenance": "deterministic",
      "evidence_refs": [
        "endpoint:POST /api/chat/sessions"
      ]
    },
    {
      "element_id": "flow-user-api",
      "type": "data_flow",
      "kind": null,
      "name": "HTTPS 請求",
      "from": "ext-tenant-user",
      "to": "proc-invoices-api",
      "crosses": [
        "tb-internet"
      ],
      "provenance": "deterministic",
      "evidence_refs": []
    },
    {
      "element_id": "tb-internet",
      "type": "trust_boundary",
      "kind": "network",
      "name": "網際網路／staging 邊界",
      "from": null,
      "to": null,
      "crosses": [],
      "provenance": "g1_declared",
      "evidence_refs": []
    },
    {
      "element_id": "store-invoices",
      "type": "data_store",
      "kind": null,
      "name": "invoices 表（無 RLS）",
      "from": null,
      "to": null,
      "crosses": [],
      "provenance": "deterministic",
      "evidence_refs": [
        "inventory:/db/tables/0/rls_enabled"
      ]
    },
    {
      "element_id": "flow-api-db",
      "type": "data_flow",
      "kind": null,
      "name": "Prisma 查詢",
      "from": "proc-invoices-api",
      "to": "store-invoices",
      "crosses": [],
      "provenance": "deterministic",
      "evidence_refs": [
        "code:routes/invoices.ts:42"
      ]
    },
    {
      "element_id": "store-orders",
      "type": "data_store",
      "kind": null,
      "name": "orders 表",
      "from": null,
      "to": null,
      "crosses": [],
      "provenance": "deterministic",
      "evidence_refs": []
    },
    {
      "element_id": "flow-agent-refund",
      "type": "data_flow",
      "kind": null,
      "name": "refund 工具呼叫",
      "from": "proc-support-agent",
      "to": "store-orders",
      "crosses": [],
      "provenance": "llm_proposed",
      "evidence_refs": [
        "code:app/support/agent.py:57"
      ]
    },
    {
      "element_id": "tb-baas",
      "type": "trust_boundary",
      "kind": "third_party",
      "name": "BaaS storage（第三方平台）",
      "from": null,
      "to": null,
      "crosses": [],
      "provenance": "g1_declared",
      "evidence_refs": []
    },
    {
      "element_id": "store-support-uploads",
      "type": "data_store",
      "kind": null,
      "name": "support-uploads bucket（BaaS storage）",
      "from": null,
      "to": null,
      "crosses": [],
      "provenance": "deterministic",
      "evidence_refs": [
        "inventory:/db/storage_buckets/0"
      ]
    },
    {
      "element_id": "flow-browser-uploads",
      "type": "data_flow",
      "kind": null,
      "name": "瀏覽器以簽名 URL 直接上傳文件到 BaaS storage",
      "from": "ext-tenant-user",
      "to": "store-support-uploads",
      "crosses": [
        "tb-internet",
        "tb-baas"
      ],
      "provenance": "g1_declared",
      "evidence_refs": [
        "inventory:/features/0"
      ]
    }
  ],
  "b1_diff": [
    {
      "diff_id": "BD-001",
      "kind": "only_merged",
      "element_id": "store-invoices",
      "summary": "外部視角看不到 invoices 表缺少 RLS",
      "disposition": "accepted",
      "threat_ids": [
        "T-012"
      ],
      "reason": null,
      "decided_by": "tm_critic"
    },
    {
      "diff_id": "BD-002",
      "kind": "only_merged",
      "element_id": "flow-agent-refund",
      "summary": "外部視角沒有看到 agent 直接呼叫 refund",
      "disposition": "accepted",
      "threat_ids": [
        "T-031"
      ],
      "reason": null,
      "decided_by": "tm_critic"
    },
    {
      "diff_id": "BD-003",
      "kind": "attribute_mismatch",
      "element_id": "flow-user-api",
      "summary": "外部視角標示 HTTP/1.1，程式碼啟用 HTTP/2",
      "disposition": "dismissed",
      "threat_ids": [],
      "reason": "與安全無關的屬性差異",
      "decided_by": "tm_critic"
    }
  ]
}
